Stakeholder Name,Category,Organization,Role in Ecosystem,Influence,Interest,Position,Engagement Strategy,Owner,Recent Developments,Engagement History,Opportunity Window,Last Interaction Date,Next Action,Priority
Ministry of Finance,Government,Federal Government,Policy Regulator & Funding Authority,High,High,Supportive,Engage (Manage closely),Priya Sharma,New infrastructure budget announced FY2025,3 formal meetings in 2024; quarterly briefings established,Budget planning cycle – March 2025,2024-12-10,Present Q1 impact report by Jan 15,High
Ravi Mehta (MP),Political,State Legislature,Key Decision Influencer,High,Medium,Neutral,Consult (Keep satisfied),Anil Verma,Re-elected Nov 2024; new portfolio assigned,1 introductory meeting; newsletter subscriber,New term consultations – Feb 2025,2024-11-20,Schedule meeting for new term,High
GreenFuture NGO,NGO/Civil Society,GreenFuture Foundation,Community Advocate & Watchdog,Medium,High,Resistant,Engage (Manage closely),Sunita Rao,Published critical report on environmental impact,2 consultations; ongoing correspondence,Annual stakeholder forum – April 2025,2024-12-01,Address environmental concerns in briefing doc,High
Infra Corp Ltd,Corporate,Infra Corp Ltd,Implementation Partner,High,High,Supportive,Engage (Manage closely),Rajan Kapoor,MOU signed October 2024,Weekly project calls; 5 site visits conducted,Contract renewal – Q1 2025,2024-12-15,Review deliverable milestone report,High
Jodhpur State University,Academic,State University,Research & Knowledge Partner,Medium,Medium,Supportive,Keep Informed,Priya Sharma,New research dept head appointed,1 joint workshop; collaboration proposed,Research grant application – March 2025,2024-10-05,Send project data for research use,Medium
Daily Tribune,Media,Tribune Media Group,Public Narrative Shaper,Medium,Low,Neutral,Keep Informed,Anil Verma,Covered project launch Oct 2024,1 press briefing; press release issued,Milestone announcement – Q2 2025,2024-10-20,Prepare media kit for next milestone,Medium
Residents Welfare Assoc.,Community,Sector 7 RWA,Affected Community Representative,Low,High,Resistant,Consult (Keep satisfied),Sunita Rao,Submitted formal objection Dec 2024,Town hall meeting; 2 grievance sessions,Community review – Jan 2025,2024-12-05,Respond to formal objection within 10 days,High
World Bank Mission,International,World Bank Group,Funding & Technical Advisor,High,Medium,Supportive,Consult (Keep satisfied),Rajan Kapoor,Supervision mission scheduled Feb 2025,Biannual reviews; ongoing reporting,Supervision mission – Feb 2025,2024-09-15,Prepare progress report for mission,Medium